source,content,word_count,sentence_count,avg_word_length,readability,avg_similarity
https://www.thehindu.com/news/national/telangana/layoffs-unpaid-wages-toxic-work-culture-plague-young-employees-of-hyderabads-startups/article68689863.ece,"from the Secretary, which created a sense of fear among the employees,” she told The Hindu. “When I decided to leave, the company denied returning my original documents which they had taken from me as ‘security’ during my recruitment. I was forced to take up extra work in exchange for my documents and had to forfeit a month’s salary,” she added. The recent death of a 26-year-old Chartered Accountant Anna Sebastian Perayil, who worked at Ernst & Young (EY) in Pune, allegedly owing to extreme work pressure, has brought to the forefront conversations about fostering healthier work cultures. Upon being asked about long-term solutions to the prevailing work culture across the city, Anita Rego, a Hyderabad-based psychiatric social worker observes: “Victim blaming can become counterproductive and result in job resignations and increased employee health concerns. There is a tendency to shift the narrative onto the individual who is under stress. Workplace toxicity is an organisational issue and thus, the systemic issues at the organisation need to be resolved.” Ms. Rego, who is the curator of a two-year programme called ‘Tuning into Empathetic Leadership’, supporting a group of production companies to reduce bullying, harassment and grievances at the workplace, emphasises that healthier workplaces and happier manpower contribute to better productivity and profits, while urging companies to initiate employee support programmes. Published - October 04, 2024 11:18 pm IST Hyderabad / Telangana / startups / labour Copyright© 2024, THG PUBLISHING PVT LTD. or its affiliated companies. All rights reserved. BACK TO TOP Terms & conditions | Institutional Subscriber Comments have to be in English, and in full sentences. They cannot be abusive or personal. Please abide by our community guidelines for posting your comments. We have migrated to a new commenting platform. If you are already a registered user of The Hindu",300,17,5.44,44.44,0.48140837233261086
https://www.thehindu.com/news/national/telangana/layoffs-unpaid-wages-toxic-work-culture-plague-young-employees-of-hyderabads-startups/article68689863.ece,"and logged in, you may continue to engage with our articles. If you do not have an account please register and login to post comments. Users can access their older comments by logging into their accounts on Vuukle.",38,4,4.657894736842105,75.5,0.19407052843908495
https://papers.ssrn.com/sol3/papers.cfm?abstract_id=4048986,"21 Pages Posted: 13 Apr 2022 Karimganj Polytechnic Date Written: feb 3, 2022 The surge of venturing into independent business set-up has climbed a notch higher in the last decade. The numbers are telling - from 3,100 startups in 2014 to a projection of more than 11,500 by 2022, this is certainly not a passing trend. It’s a revolution. And it’s going to change the way the markets are working today in India. India, thereby inevitably proves to be a popular eco-system for any start-up to find its prominence. Although the success rate of startups has always dimmed low in India. Reasons’ being plenty, the most commonly repeated mistake is the unapologetic nature of Indian young entrepreneurs trying to adopt or rather imitate the business culture or corporate culture prevalent in the western nations. Now the failure rate of the startups has much to do with the strategy and decisions incorporated by the founder or the CEOs of the company.There are many organizational theories as to what a start-up should refer before starting its operations. 80% of its compliance depends upon its founder, which can be supposedly established among its first 20 employees. But things start getting diverse when there are more than 50 employees in a start-up. Keywords: Work culture, entrepreneurs, start-ups, employees JEL Classification: M13 Suggested Citation: Suggested Citation KarimganjKarimganj, Assam 788710India08133888074 (Phone)788710 (Fax) Entrepreneurship, Innovation, & Growth eJournal Subscribe to this fee journal for more curated articles on this topic Entrepreneurship & Management eJournal Subscribe to this fee journal for more curated articles on this topic Entrepreneurship & Economics eJournal Subscribe to this fee journal for more curated articles on this topic All content on this site: Copyright © 2024 Elsevier Inc., its licensors, and contributors. All rights are reserved, including those for text and data mining,",300,14,5.453333333333333,50.06,0.45301150073479685
https://papers.ssrn.com/sol3/papers.cfm?abstract_id=4048986,"AI training, and similar technologies. For all open access content, the relevant licensing terms apply. We use cookies to help provide and enhance our service and tailor content. To learn more, visit Cookie Settings. This page was processed by aws-apollo-l200 in 0.059 seconds",43,6,5.441860465116279,62.75,0.21517512573151598
https://www.linkedin.com/pulse/why-do-indian-startups-struggle-maintain-healthy-employee-dixit-uhd8c,"Agree & Join LinkedIn By clicking Continue to join or sign in, you agree to LinkedIn’s User Agreement, Privacy Policy, and Cookie Policy. Dear Readers, Startups are often hailed as the engines of innovation and economic growth, but beneath the glamour lies a pressing issue: many Indian startups struggle to sustain a healthy workplace culture. This newsletter delves into the reasons behind this challenge, supported by detailed statistics and insights. India is home to over 84,000 registered startups as of 2023, with the ecosystem valued at over $450 billion. However, cultural challenges within these startups paint a stark picture: 70% of employees in Indian startups report experiencing burnout, according to a 2022 Nasscom survey. 55% feel a lack of career development opportunities, highlighting a gap in long-term growth planning. 45% cite poor work-life balance as a significant issue, as revealed by an EY study on workplace dynamics. Only 30% of startup employees feel their organizations provide adequate mental health support, according to a survey by LinkedIn India. Startups often prioritize rapid scaling and revenue generation, sidelining employee well-being. A McKinsey report found that 85% of Indian startups prioritize market capture over organizational health, leading to overworked teams. Founders, often young and first-time entrepreneurs, lack managerial expertise. A KPMG study noted that 60% of startup leaders have no prior experience managing teams, resulting in poor communication and unclear expectations. HR functions are often underfunded or underdeveloped. 42% of startups have no formal grievance redressal mechanisms, according to a Deloitte survey. Unrealistic KPIs foster internal competition rather than collaboration. A Harvard Business Review article highlights that 63% of Indian startup employees feel undervalued in their roles, contributing to dissatisfaction. Compensation packages often emphasize stock options over competitive salaries. 48% of employees feel financially insecure, as per a PwC report, citing delayed ROI",300,18,5.903333333333333,37.71,0.34866629234890406
https://www.linkedin.com/pulse/why-do-indian-startups-struggle-maintain-healthy-employee-dixit-uhd8c,"on equity-based pay. The average attrition rate in Indian startups is 30-40%, compared to the global average of 20%. A 2023 report by TeamLease Services found that 57% of employees leave within two years, citing burnout and lack of growth. Disengaged employees cost companies 34% of their salary in lost productivity, according to Gallup. Startups with low employee satisfaction see up to a 25% dip in productivity, as per an Assocham study. Poor reviews on platforms like Glassdoor deter top talent. 78% of prospective employees check online reviews, and 40% decline offers due to negative feedback, according to a survey by Indeed. Invest in training founders and managers in people management and emotional intelligence. Companies that prioritize leadership training see a 15% increase in employee retention, as per a study by Korn Ferry. Implement mental health programs, flexible working hours, and initiatives to prevent burnout. Organizations with robust well-being programs report a 21% increase in employee satisfaction, according to the World Economic Forum. Encourage open dialogue about challenges and achievements to build trust. Transparency can reduce turnover by 18%, as shown in a Glassdoor report. Develop robust policies for career growth, grievance handling, and workplace ethics. Startups with strong HR policies experience a 32% lower attrition rate, as per Deloitte. Balance financial goals with employee satisfaction metrics to create a sustainable growth model. Companies that incorporate employee satisfaction into KPIs see a 20% boost in overall performance, according to McKinsey. The Indian startup ecosystem holds immense potential, but its true success lies in fostering a culture where employees thrive alongside the business. Addressing these challenges with data-driven strategies can transform workplaces into hubs of innovation and satisfaction. What are your thoughts on this issue? Let us know! Sr. Supply Chain Manager Nice article very thoughtfully written with great insights and",300,21,5.736666666666666,49.21,0.3705633170822616
https://www.linkedin.com/pulse/why-do-indian-startups-struggle-maintain-healthy-employee-dixit-uhd8c,"study. Automotive, Electrification & Mobility 18+ years global experience | Proven transformations to help CEOs unlock profits and clients in the EU, Middle East & APAC These challenges are significant, and addressing them is crucial for the growth of Indian startups. It's essential to foster a supportive ecosystem that helps startups navigate these hurdles effectively. Thank you for highlighting this important issue! To view or add a comment, sign in The Rise of Quick Commerce According to research by RedSeer, India’s Q-commerce market is projected to grow to $5… Delhi-NCR has become synonymous with hazardous air quality, particularly during the winter months. The Air Quality… I’m excited to present the comprehensive performance report of our Operations Team for the past quarter. Our progress… In an increasingly competitive market, the success of your business hinges on the precision and efficiency of your… As Direct-to-Consumer (D2C) brands continue to expand rapidly in India, ensuring the safe delivery of products to… India's startup environment has seen remarkable development, laying down a good foundation for itself as a central part… Zepto and Blinkit, let's delve into the specifics, including some numerical data and a detailed list of pros and cons… Dear Perusers, In the realm of Direct-to-Buyer (D2C) brands, stock administration is a foundation of progress. While it… Operations in the logistics department of a Direct-to-Consumer (D2C) brand, the Key Responsibility Areas (KRAs) should… Introduction In the modern business world, effective inventory management stands as a cornerstone of profitability…",245,7,5.669387755102041,19.44,0.43448121382725075
